{
  "$schema": "../schemas/procedural-course.schema.json",
  "schema_version": "procedural-course-v1",
  "generator_version": "0.5.0",
  "stage_count": 8,
  "platform_width": 12,
  "platform_length": 12,
  "platform_height": 1,
  "gap_range": [3.5, 7.0],
  "offset_range": [-5.0, 5.0],
  "beam_width_range": [1.5, 3.0],
  "beam_length_range": [8.0, 16.0],
  "stair_count_range": [3, 6],
  "stair_run": 3,
  "stair_rise": 1,
  "max_jump_gap": 8,
  "max_lateral_offset": 6,
  "max_oracle_jump_distance": 9,
  "min_oracle_beam_width": 1.25,
  "max_course_rise": 16,
  "max_generation_attempts": 32,
  "kill_plane_y": -25
}
